subject,chapter,concept,difficulty,par_time_sec,question_text,option_a,option_b,option_c,option_d,correct_option
Physics,Motion in a Plane,Scalar product of vectors,Hard,90,"If A = cos(wt) i + sin(wt) j and B = cos(wt/2) i + sin(wt/2) j are functions of time, the value of t at which they are orthogonal is:",t = 0,t = pi/(4w),t = pi/(2w),t = pi/w,D
Physics,Waves,Doppler effect,Hard,90,"A source emitting sound of frequency 100 Hz moves at 19.4 m/s at 60 degrees to the source-observer line; the observer is at rest. The apparent frequency observed (speed of sound = 330 m/s) is:",97 Hz,100 Hz,103 Hz,106 Hz,C
Physics,System of Particles and Rotational Motion,Torque and angular deceleration,Hard,90,"An automobile moves at 54 km/h. Its wheels have radius 0.45 m and moment of inertia 3 kg m^2. If brought to rest in 15 s, the magnitude of the average braking torque on each wheel is:",2.86 kg m^2 s^-2,6.66 kg m^2 s^-2,8.58 kg m^2 s^-2,10.86 kg m^2 s^-2,B
Physics,Moving Charges and Magnetism,Torque on a current loop,Hard,90,"A rectangular coil 0.12 m by 0.1 m with 50 turns carries 2 A in a uniform field of 0.2 Wb/m^2. If the plane of the coil is inclined at 30 degrees to the field, the torque to keep it in equilibrium is:",0.12 Nm,0.15 Nm,0.20 Nm,0.24 Nm,C
Physics,Kinetic Theory,Ideal gas and density,Hard,90,"Two vessels contain ideal gases A and B at the same temperature. The pressure of A is twice that of B and the density of A is 1.5 times that of B. The ratio of molecular weight of A to B is:",1/2,2/3,3/4,2,C
Physics,Semiconductor Electronics,Diode in a circuit,Medium,60,"A diode is connected to an external resistance R = 100 ohm and an emf of 3.5 V. If the barrier potential across the diode is 0.5 V, the current in the circuit is:",35 mA,30 mA,40 mA,20 mA,B
Physics,Motion in a Plane,Uniform circular motion,Hard,90,"The position vector of a particle is R = 4 sin(2 pi t) i + 4 cos(2 pi t) j (R in metres, t in seconds). Which statement about the motion is WRONG?",The path is a circle of radius 4 m,The acceleration vector is along -R,The magnitude of acceleration is v^2/R where v is the speed,The magnitude of the velocity is 8 m/s,D
Physics,System of Particles and Rotational Motion,Moment of inertia and work,Hard,90,"Point masses m1 and m2 are at the ends of a rigid rod of length L and negligible mass rotated about a perpendicular axis. The position x of the axis for which the work to rotate it at w0 is minimum is:",m2 L / (m1 + m2),m1 L / (m1 + m2),(m1/m2) L,(m2/m1) L,A
Physics,Wave Optics,Single-slit diffraction,Hard,75,"At the first minimum adjacent to the central maximum of a single-slit diffraction pattern, the phase difference between the wavelet from the edge of the slit and that from the midpoint is:",pi/8 radian,pi/4 radian,pi/2 radian,pi radian,D
Physics,System of Particles and Rotational Motion,Conservation of angular momentum,Hard,90,"A force F = alpha i + 3 j + 6 k acts at the point r = 2 i - 6 j - 12 k. The value of alpha for which the angular momentum about the origin is conserved is:",1,-1,2,Zero,B
Physics,Motion in a Plane,Relative velocity and collision,Hard,90,"Two particles A and B move with constant velocities v1 and v2 from initial positions r1 and r2. The condition for A and B to collide is:",r1 cross v1 = r2 cross v2,(r1 - r2)/|r1 - r2| = (v2 - v1)/|v2 - v1|,r1 dot v1 = r2 dot v2,r1 cross v2 = r2 cross v1,B
Physics,Nuclei,Radioactive decay and momentum,Medium,60,"A uranium nucleus at rest decays into a thorium nucleus and a helium nucleus. Then:",The helium nucleus has less kinetic energy than the thorium nucleus,The helium nucleus has more kinetic energy than the thorium nucleus,The helium nucleus has less momentum than the thorium nucleus,The helium nucleus has more momentum than the thorium nucleus,B
Physics,Current Electricity,Conductivity in series,Hard,90,"Two metal wires of identical dimensions are connected in series. If sigma1 and sigma2 are their conductivities, the effective conductivity of the combination is:",sigma1 sigma2 / (sigma1 + sigma2),2 sigma1 sigma2 / (sigma1 + sigma2),(sigma1 + sigma2) / (2 sigma1 sigma2),(sigma1 + sigma2) / (sigma1 sigma2),B
Physics,Dual Nature of Radiation and Matter,Photoelectric effect and de Broglie,Hard,90,"Light of wavelength 500 nm is incident on a metal of work function 2.28 eV. The de Broglie wavelength of the emitted electron is approximately:",less than or equal to 2.8 x 10^-12 m,less than 2.8 x 10^-10 m,less than 2.8 x 10^-9 m,greater than or equal to 2.8 x 10^-9 m,D
Physics,Kinetic Theory,Speed of sound and heat capacity,Hard,90,"4.0 g of a gas occupies 22.4 L at NTP and has Cv = 5.0 J/K/mol. If the speed of sound in the gas at NTP is 952 m/s, its Cp is (R = 8.3 J/K/mol):",8.5 J/K/mol,8.0 J/K/mol,7.5 J/K/mol,7.0 J/K/mol,B
Physics,Alternating Current,Capacitive reactance,Hard,75,"A series R-C circuit is connected to an AC source. Case (a) the capacitor is air-filled; case (b) the capacitor is mica-filled. If the current through the resistor is i and the voltage across the capacitor is V, then:",Va = Vb,Va < Vb,Va > Vb,ia > ib,C
Physics,Laws of Motion,Friction on an incline,Hard,90,"A plank with a box on one end is gradually raised. At 30 degrees inclination the box starts to slip and slides 4.0 m down the plank in 4.0 s. The coefficients of static and kinetic friction respectively are:",0.4 and 0.3,0.6 and 0.6,0.6 and 0.5,0.5 and 0.6,C
Physics,Laws of Motion,Centripetal force,Hard,75,"Two stones of mass m and 2m are whirled in horizontal circles, the heavier at radius r/2 and the lighter at radius r. The tangential speed of the lighter is n times that of the heavier when both experience the same centripetal force. n is:",1,2,3,4,B
Physics,Work Energy and Power,Energy loss in collision,Hard,90,"A ball is thrown vertically downward from a height of 20 m with initial velocity v0. It loses 50% of its energy on hitting the ground and rebounds to the same height. v0 is (g = 10 m/s^2):",10 m/s,14 m/s,20 m/s,28 m/s,C
Physics,Work Energy and Power,Elastic collision in two dimensions,Hard,90,"On a frictionless surface a block of mass M moving at speed v collides elastically with an identical block at rest. After the collision the first block moves at an angle to its initial direction with speed v/3. The speed of the second block is:",(sqrt3 / 2) v,(2 sqrt2 / 3) v,(3/4) v,(3/sqrt2) v,B
Physics,Electrostatic Potential and Capacitance,Electric field from potential,Hard,90,"The potential in a region is V = 6xy - y + 2yz volts. The electric field (in N/C) at the point (1,1,0) is:",-(6 i + 9 j + k),-(3 i + 5 j + 3 k),-(6 i + 5 j + 2 k),-(2 i + 3 j + k),C
Physics,Wave Optics,Intensity in interference,Hard,75,"In Young's experiment two slits have widths in the ratio 1:25. The ratio of maximum to minimum intensity Imax/Imin is:",4/9,9/4,121/49,49/121,B
Physics,Mechanical Properties of Fluids,Power and fluid pressure,Hard,90,"A man's heart pumps 5 L of blood per minute at a pressure of 150 mm of mercury. If the density of mercury is 13.6 x 10^3 kg/m^3 and g = 10 m/s^2, the power of the heart is:",1.50 W,1.70 W,2.35 W,3.0 W,B
Physics,Moving Charges and Magnetism,Charged particle in a magnetic field,Hard,90,"A proton and an alpha particle enter a uniform magnetic field at right angles. If the radii of their circular paths are equal and the proton's kinetic energy is 1 MeV, the alpha particle's kinetic energy is:",1 MeV,4 MeV,0.5 MeV,1.5 MeV,A
Physics,Semiconductor Electronics,Common emitter amplifier,Hard,75,"The input to a CE amplifier of voltage gain 150 is Vi = 2 cos(15t + pi/3). The output signal is:",300 cos(15t + 4pi/3),300 cos(15t + pi/3),75 cos(15t + 2pi/3),2 cos(15t + 5pi/6),A
Physics,Current Electricity,Ammeter with shunt,Hard,90,"A circuit has an ammeter, a 30 V battery and a 40.8 ohm resistance in series. The ammeter coil has resistance 480 ohm with a shunt of 20 ohm. The ammeter reads:",1 A,0.5 A,0.25 A,2 A,B
Physics,Mechanical Properties of Fluids,Capillary rise,Medium,60,"Water rises to a height h in a capillary tube. If the length of the tube above the water surface is made less than h, then:",Water does not rise at all,Water rises to the tip and overflows like a fountain,Water rises to the top and stays without overflowing,Water rises to a point a little below the top and stays there,C
Physics,Ray Optics and Optical Instruments,Astronomical telescope,Hard,75,"In an astronomical telescope in normal adjustment a straight black line of length L is drawn on the objective. The eyepiece forms a real image of length I. The magnification of the telescope is:",L/I,L/I + 1,L/I - 1,(L+I)/(L-I),A
Physics,Dual Nature of Radiation and Matter,Work function from photoelectric data,Hard,90,"A surface is illuminated successively by light of wavelength lambda and lambda/2. If the maximum kinetic energy of photoelectrons in the second case is three times that in the first, the work function is:",hc/(3 lambda),hc/(2 lambda),hc/lambda,2hc/lambda,B
Physics,Ray Optics and Optical Instruments,Total internal reflection in a prism,Hard,90,"A beam of red, green and blue light is incident on a right-angled prism. The refractive indices for red, green and blue are 1.39, 1.44 and 1.47. The prism will:",Separate the red part from the green and blue,Separate the blue part from the red and green,Separate all three colours,Not separate the three colours,A
