subject,chapter,concept,difficulty,par_time_sec,question_text,option_a,option_b,option_c,option_d,correct_option,reason,q_no,page
Physics,Electrostatic Potential and Capacitance,Electrostatic Potential and Capacitance,Medium,60,"A capacitor of 2μF is charged as shown in the diagram. When the switch S is turned to position 2, the percentage of its stored energy dissipated is:",0%,20%,75%,80%,D,figure/parse,5,3
Physics,Work Energy and Power,Work Energy and Power,Medium,60,"A npn transistor is connected in common emitter configuration in a given amplifier. A load resistance of 800 Ω is connected in the collector circuit and the voltage drop across it is 0.8 V. If the current amplification factor is 0.96 and the input resistance of the circuit is 192 Ω, the voltage gain and the power gain of the amplifier will respectively be:","4, 3.84","3.69, 3.84","4, 4","4, 3.69",A,figure/parse,17,12
Physics,Waves,Waves,Medium,60,"When a metallic surface is illuminated with radiation of wavelength λ, the stopping potential is V. If the same surface is illuminated with radiation of wavelength 2λ, the stopping potential is V",,,,,,no answer key,29,19
Physics,General,General,Medium,60,"To get output 1 for the following circuit, the correct choice for the input is:","A = 0, B = 1, C = 0","A = 1, B = 0, C = 0","A = 1, B = 1, C = 0","A = 1, B = 0, C = 1",D,figure/parse,34,22
Physics,Work Energy and Power,Work Energy and Power,Medium,60,"An inductor 20 mH, a capacitor 50 μF and a resistor 40 Ω are connected in series across a source of emf V = 10 sin 340 t. The power loss in A.C. circuit is :",0.51 W,0.67 W,0.76 W,0.89 W,A,figure/parse,40,25
Chemistry,Solutions,Solutions,Medium,60,The product obtained as a result of a reaction of nitrogen with CaC2 is:,Ca(CN)2,CaCN,CaCN3,Ca2CN Solution: (Bonus) CaC2 + N2 Calcium Nitrogen Carbide Gas → CaCN2 + C Calcium Cyanamide CaCN2 is not given in the option so it should be bonus.,,no answer key,71,37
Chemistry,General,General,Medium,60,Which of the following biphenyls is optically active? 42,,,,,B,figure/parse,84,41
Biology,Evolution,Evolution,Medium,60,Which of the following structures is homologus to the wing of a bird?,Dorsal fin of a shark,Wing of a moth,Hind limb of rabbit,Flipper of whale,D,figure/parse,144,63
